{
  "$schema": "http://json-schema.org/draft-07/schema#",
  "title": "Character",
  "type": "object",
  "required": [
    "id",
    "type",
    "name"
  ],
  "properties": {
    "id": {
      "type": "string",
      "pattern": "^character_[a-z0-9_]+$"
    },
    "type": {
      "const": "character"
    },
    "name": {
      "type": "string"
    },
    "aliases": {
      "type": "array",
      "items": {
        "type": "string"
      }
    },
    "epithets": {
      "type": "array",
      "items": {
        "type": "string"
      }
    },
    "culture": {
      "type": [
        "string",
        "null"
      ]
    },
    "species": {
      "type": "string",
      "default": "human"
    },
    "status": {
      "type": "string",
      "enum": [
        "alive",
        "deceased",
        "unknown",
        "mythic"
      ]
    },
    "epoch": {
      "type": [
        "string",
        "null"
      ]
    },
    "roles": {
      "type": "array",
      "items": {
        "type": "string"
      }
    },
    "relations": {
      "type": "object",
      "properties": {
        "parents": {
          "type": "array",
          "items": {
            "type": "string"
          }
        },
        "siblings": {
          "type": "array",
          "items": {
            "type": "string"
          }
        },
        "spouse": {
          "anyOf": [
            {
              "type": "string"
            },
            {
              "type": "null"
            },
            {
              "type": "array",
              "items": {
                "type": "string"
              }
            }
          ],
          "description": "One spouse, none, or several -- Khadi, Meera and Mehme each have more than one."
        },
        "children": {
          "type": "array",
          "items": {
            "type": "string"
          }
        }
      }
    },
    "reincarnation_of": {
      "type": "string",
      "description": "An earlier character this one is a rebirth of.\n\nDeliberately not a key under `relations`, which is kinship -- parents, siblings, spouse, children. A rebirth is not a relative; Guyuk the Seed-Gleaner is not descended from Guyuk the Storm-Bone Khan, she is her.\n\nThis exists because one character was a participant in events four epochs apart. `epoch` says when someone first appears rather than the only era they may act in, so that was legal and not wrong -- but a teenage steppe nomad standing in the era after the Shattering is a different claim from a guardian outliving one, and canon should say which it means. Two entities with a link between them says it; one entity in five events across four eras does not.\n\n`lint_story.py` checks the target exists and sits in an earlier epoch: a rebirth that precedes its own life is the same error as an event edge running backwards through time.",
      "pattern": "^character_[a-z0-9_]+$"
    },
    "physical": {
      "type": "object"
    },
    "notes": {
      "type": "string"
    },
    "canon": {
      "type": "string",
      "enum": [
        "primary",
        "secondary",
        "draft"
      ],
      "default": "primary"
    },
    "sample": {
      "type": "boolean",
      "description": "Marks this entity as a retained test fixture rather than canon.\n\nThe Dragon's Spine episode -- an event, the king who fought it, the dragon, and the range it happened in -- was written to exercise the tooling and kept on purpose, because four entities spread across four folders is a genuinely useful thing to test against. It is not part of the story.\n\nMarked on the entity rather than in a registry, so it is visible to anyone reading the file. `lint_story.py` enforces the isolation that makes it safe to keep: nothing that is not itself a sample may reference a sample, so the fixture cannot quietly become load-bearing."
    },
    "sources": {
      "type": "array",
      "items": {
        "type": "string"
      }
    }
  },
  "additionalProperties": false
}
