{
  "id": "character_ranu",
  "type": "character",
  "name": "Ranu",
  "culture": "vedda",
  "species": "human",
  "status": "alive",
  "epoch": "migrations",
  "roles": ["brother", "manipulated"],
  "relations": {
    "siblings": ["character_bela"],
    "spouse": "character_meera"
  },
  "notes": "Vedda brother manipulated by Sira (The Wandered Face) into massacring a Jharwa village in the Aravalis. Forced marriage to survivor Meera.",
  "canon": "primary",
  "sources": ["AI_CONTEXT.md"]
}
