{
  "id": "character_aurum_theophanes",
  "type": "character",
  "name": "Aurum Theophanes",
  "culture": "outlier",
  "species": "human",
  "status": "unknown",
  "epoch": "epoch_current",
  "roles": [
    "chronicler",
    "outsider"
  ],
  "notes": "Outlier chronicler name preserved in fringe notes of the Current Era. Association with Narmada academic circles is conjectural.",
  "canon": "draft",
  "sources": [
    "AI_CONTEXT.md"
  ]
}
